{
  "schema_version": "1.0.0",
  "artifact_type": "business_feasibility_report",
  "report_id": "BFR-2026-07-05-001",
  "task_id": "TASK-2026-07-05-UVP-001",
  "created_at": "2026-07-05T09:15:00Z",
  "created_by": "business_strategist",
  "initiative_name": "AI-DOS Control Plane Commercialization",
  "opportunity_statement": "Package AI-DOS as an enterprise orchestration control plane that helps software teams govern AI agents, reduce delivery risk, and improve auditability for high-stakes work.",
  "analysis_scope": {
    "geographies": ["US", "EU"],
    "time_horizon_months": 24,
    "primary_segment": "Mid-market and enterprise software organizations adopting AI-assisted delivery",
    "secondary_segments": [
      "Regulated SaaS companies",
      "Platform engineering teams"
    ],
    "pricing_currency": "USD"
  },
  "evidence_sources": [
    {
      "source_type": "desk_research",
      "summary": "Enterprise buyers increasingly require governance, auditability, and approval controls for AI-assisted engineering workflows.",
      "confidence": "medium"
    },
    {
      "source_type": "competitive_scan",
      "summary": "Most agentic tooling emphasizes raw automation speed more than policy-bound orchestration, leaving a governance positioning gap.",
      "confidence": "medium"
    },
    {
      "source_type": "expert_input",
      "summary": "Engineering leaders report growing concern about uncontrolled AI changes to production systems and missing audit trails.",
      "confidence": "medium"
    }
  ],
  "customer_segments": [
    {
      "segment_name": "Enterprise engineering leadership",
      "user_persona": "VP Engineering / Platform Director",
      "buyer_persona": "CTO / VP Engineering",
      "pain_points": [
        "Uncontrolled AI-generated code changes",
        "Weak audit trails for approvals and rollout decisions",
        "Difficulty enforcing policy across multiple agents"
      ],
      "current_alternatives": [
        "Manual review workflows",
        "Ad hoc scripts",
        "Generic CI/CD policy gates"
      ],
      "willingness_to_pay_signal": "strong",
      "access_difficulty": "medium"
    }
  ],
  "competitor_landscape": [
    {
      "name": "Generic AI coding copilots",
      "category": "indirect",
      "strengths": [
        "High awareness",
        "Fast code generation",
        "Easy user adoption"
      ],
      "weaknesses": [
        "Limited workflow governance",
        "Weak task-state traceability",
        "Not designed as a control plane"
      ],
      "positioning_gap": "Governed orchestration with explicit approvals, state transitions, and artifact validation."
    },
    {
      "name": "Internal enterprise engineering workflows",
      "category": "substitute",
      "strengths": [
        "Already embedded in the organization",
        "Low vendor risk perception"
      ],
      "weaknesses": [
        "Manual and inconsistent",
        "Hard to scale across many agents",
        "Weak commercial-grade productization"
      ],
      "positioning_gap": "Standardized and auditable AI-delivery governance without bespoke internal tooling overhead."
    }
  ],
  "uvp": {
    "statement": "AI-DOS gives enterprise software teams a governed AI delivery control plane with explicit approvals, machine-validated artifacts, and auditable lifecycle state transitions.",
    "target_customer": "Engineering organizations deploying AI agents in software delivery",
    "differentiators": [
      "State-machine-enforced governance",
      "Artifact-level validation",
      "Built-in approval and rollback discipline"
    ],
    "switching_trigger": "An organization begins using multiple AI agents for production-affecting work and needs policy, traceability, and risk control."
  },
  "monetization_strategy": {
    "revenue_model": "subscription",
    "pricing_hypothesis": "Annual platform subscription priced by team size and governance tier, with premium pricing for regulated environments.",
    "sales_motion": "enterprise_sales",
    "acquisition_channels": [
      "Founder-led enterprise outreach",
      "Technical thought leadership",
      "Targeted platform engineering partnerships"
    ],
    "expansion_paths": [
      "Additional engineering teams",
      "Security and compliance workflow modules",
      "Cross-functional AI governance use cases"
    ]
  },
  "financial_feasibility": {
    "estimated_build_cost": 180000,
    "estimated_gtm_cost": 90000,
    "estimated_monthly_opex": 18000,
    "expected_gross_margin_pct": 78,
    "break_even_months": 16,
    "profitability_outlook": "attractive",
    "key_cost_drivers": [
      "Enterprise implementation support",
      "Security and compliance hardening",
      "Customer success for early lighthouse accounts"
    ]
  },
  "strategic_risks": [
    {
      "risk": "Long enterprise sales cycles may delay initial revenue realization.",
      "severity": "high",
      "mitigation": "Target lighthouse design partners with urgent governance pain and narrow MVP packaging."
    },
    {
      "risk": "Buyers may see internal workflow tooling as good enough in the early market.",
      "severity": "medium",
      "mitigation": "Emphasize auditability, policy enforcement, and lower operational burden versus custom internal systems."
    }
  ],
  "assumptions": [
    "Engineering leaders will pay for governance and risk reduction rather than only automation speed.",
    "A narrow initial product focused on control-plane governance is sufficient to land the first enterprise buyers.",
    "Early customers will accept integration effort if governance value is high enough."
  ],
  "recommendation": {
    "recommended_mvp_scope": [
      "State-machine-based task governance",
      "Artifact validation and audit logging",
      "Approval, lease, and rollback controls",
      "Minimal enterprise reporting layer"
    ],
    "go_to_market_next_steps": [
      "Run 10 to 15 discovery calls with engineering leaders in regulated or high-compliance environments",
      "Test pricing willingness using design-partner conversations",
      "Package a narrow pilot offering centered on governed AI delivery"
    ],
    "decision_outcome": "conditional_go",
    "decision_rationale": "The opportunity appears commercially attractive because governance for AI-assisted delivery is emerging as a real enterprise pain point, but the initial go-to-market motion should be validated with lighthouse buyers before full-scale build investment.",
    "conditions_to_clear": [
      "Confirm willingness to pay with at least three target buyers",
      "Validate that auditability and policy controls are top-three purchase drivers",
      "Identify one repeatable acquisition channel for the first cohort"
    ],
    "confidence": "medium"
  }
}